<?xml version="1.0" encoding="utf-8"?>
<!DOCTYPE news SYSTEM "finknews.dtd">
<news lang="zh">
<cvsid>$Id: news.zh.xml,v 1.19 2006/07/09 05:56:22 babayoshihiko Exp $</cvsid>

  <newsitem>
    <date>2006-07-01</date>
    <headline>July is "Fink Update Month"</headline>
    <body>
      <p>
Fink users on PowerPC machines are advised to update their copies of
fink from the old "10.4-transitional" tree to the more recent "10.4"
tree.  We plan to discontinue the 10.4-transitional tree
by the end of July, 2006.
</p><p>
Some background: along with OS X 10.4 came a new version of the g++ compiler
(one of the workhorses of Fink), which produced code that was binary
incompatible with previous versions.  Fink, when using the 10.4-transitional 
tree, mixes the new gcc-4.0 compiler with the older g++-3.3 compiler.
This strategy gave us some extra time to make packages compatible with
g++-4.0.  The time has now come to complete that transition, and rely
exclusively on the newer tree.  The update, however, is slightly
complicated since all packages using or providing g++ libraries must
be rebuilt in the correct order.
</p><p>
If you are using OS X 10.4, you can
find out if you need to update your Fink installation
by running the command
<code>fink --version</code>.  If the Distribution version is 0.8.1.cvs
or 0.8.1.rsync, you do <em>not</em> need to update.  However, if the 
Distribution version is 0.8.0.cvs or 0.8.0.rsync, you should update,
as described below.
</p>
<p>
Many users will prefer to remove their fink installations and
start anew with the 0.8.1 installer.  Others will prefer to use the 
<link 
url="http://prdownloads.sourceforge.net/fink/scripts-10.4-update-0.4.tar.gz?download">10.4-update 
tarball (v. 0.4)</link> (around 12 MB), which includes 
precompiled versions of the basic fink packages as well as a script which
will attempt to update an existing fink installation.  Please consult
the README file which you will find within the 10.4-update directory 
(after unpacking the tarball) for further instructions.
</p>
<p>
Note: Fink users who are upgrading their systems from OS X 10.3 to OS X 10.4
can use the same two options to update their fink installations: they can
either remove their old fink installations and start over, or they can
use the same 10.4-update tarball.  The update script should not be run
until after OS X has been upgraded.
</p>
</body>
  </newsitem>

  <newsitem>
    <date>2006-06-15</date>
    <headline>New Fink release.</headline>
    <body>
      <p>
A new Fink release for OS X 10.4 (Tiger) is 
<varlink url="download/index.php">available</varlink>
 today: version 0.8.1, which can be installed on either Intel or PowerPC
hardware.
The release includes source files, binary packages, and  Fink
installers for both kinds of hardware.
</p>
      <p>
Fink on the Intel platform is still considered "beta" quality, and a number of
packages (particularly packages in the "unstable" tree) either do not compile,
or compile but do not run.  Work to improve this situation is ongoing.
</p>
<p>
Fink users on PowerPC whose existing fink installation uses the 
10.4-transitional tree (from the 0.8.0 distribution) may upgrade in
one of two ways.  The upgrade process is problematic, due to the change
in ABI of g++ libraries which requires many libraries to be recompiled.
Many users will simply wish to remove their fink installations and
start anew with the 0.8.1 installer.  Others may wish to use the new
<link url="http://prdownloads.sourceforge.net/fink/scripts-10.4-update-0.3.tar.gz?download">10.4-update tarball (v. 0.3)</link> (around 12 MB), which includes 
precompiled versions of the basic fink packages as well as a script which
will attempt to update an existing fink installation.
</p>
</body>
  </newsitem>

  <newsitem>
    <date>2006-05-10</date>
    <headline>CVS Troubles</headline>
    <body>
      <p>
As many Fink users are aware, the Fink CVS repository at sourceforge.net
has not been fully functional since March 30.  The anonymous CVS access
has not been updated since then, and as of several days ago, the developers
are also unable to update CVS in any form.
</p><p>
As we understand the current plans of sourceforge's staff (outlined
briefly on their <link 
url="http://sourceforge.net/docman/display_doc.php?docid=2352&amp;group_id=1">site
status page</link>), the old CVS servers will never be brought back in
their current form.  This is likely to mean disruption for fink users,
but at present, we cannot say what form this disruption will take.
</p><p>
Our current advice to fink users is to switch to the 'rsync' method of
updating (by running the command 'fink selfupdate-rsync').  This will at
least give you a fink installation which is current up through May 7.
If a full update to the new CVS situation turns out to be impossible
via fink's normal selfupdate command, we will post instructions here
on how to update when they become available.
</p>
<p>Update 5/24/06: CVS is now functioning again, and users using the rsync
method of selfupdating are getting up-to-date content.  If you are using
the cvs method, and can't (or don't wish to) switch to rsync, you should
download the file <code>fink-mirrors-0.24.15.2.tar.gz</code> from <link
url="http://sourceforge.net/project/showfiles.php?group_id=17203&amp;package_id=69685">the
Sourceforge file release page</link>, expand the file, and run the command
<code>./inject.pl</code> from within the <code>fink-mirrors-0.24.15.2</code> directory.  After this has been done, the <code>fink selfupdate</code> command
should again work normally.
</p>
    </body>
  </newsitem>
  <newsitem>
    <date>2006-03-03</date>
    <headline>Problem with Apple's latest Security Update</headline>
    <body>
      <p>
The Fink team has received reports of problems with the <code>rsync</code>
program which was modified by Apple's new Security Update 2006-001: for some
users, <code>fink selfupdate</code> fails to function after the Security
Update.  (The underlying cause appears to be a problem with the 
<code>--delete</code> option for <code>rsync</code>.)
</p>
      <p>
As a workaround, users can run <code>fink install rsync</code> to use
fink's rsync package rather than the Apple program.  Or, for those users
who need specific features of the Apple program (such as support for
Extended Attributes), another workaround is <code>fink selfupdate-cvs</code>
to switch from rsync to cvs updating.  
</p>
      <p>
This news item will be updated as the situation changes.
</p>
<p>Update 3/13/06: This has been resolved by security update 2006-002,
<link url="http://docs.info.apple.com/article.html?artnum=303453">according
to Apple's documentation</link>.
</p>
    </body>
  </newsitem>
<newsitem>
<date>2006-02-21</date>
<headline>Preliminary version of Fink on Intel</headline>
<body>
<p>
A preliminary version of Fink for the Intel architecture is now ready.
No binary packages are available, and things are still rough around
the edges, but it should be usable if you are patient!
</p>
<p>
To install, you need to get the file <code>fink-0.24.12.tar.gz</code>
from <link
url="http://sourceforge.net/project/showfiles.php?group_id=17203&amp;package_id=13043">the
Sourceforge file release page for Fink</link>, expand the file, and
run the command <code>./bootstrap.sh</code> .  At the end of the
bootstrap process, run <code>fink selfupdate</code> and you'll get
the currently available packages.
</p>
<p>
At last check, there were about 1750 packages in the "stable" tree, but
about 150 of those did not build.  When things are truly stable, another
annoucement will be made here.
</p>
</body>
</newsitem>

<newsitem>
<date>2006-01-10</date>
<headline>Fink ready for XCode 2.2 (but not for Intel).</headline>
<body>
<p>
Fink is now ready for XCode 2.2, with the exception of the openoffice.org 
packages (which are expected to function again when we switch to the 10.4
tree).  Users are encouraged to upgrade to XCode 2.2 whenever they wish;
XCode 2.2 will be required for running the 10.4 tree when it is released.
</p>
<p>
On the other hand, in spite of today's announcements from Apple, Fink is
not ready to run on Intel processors.  The Fink team hopes to have an
Intel-ready version of fink released within a few weeks; the Fink team does 
not advise early recipients of new iMacs to install Fink on them, but suggests
waiting until the new version of fink is ready.
</p>
<p>Fink package maintainers please take note of the new <code>Architecture</code> field, now documented in the packaging manual.
</p>
</body>
</newsitem>

<newsitem>
<date>2005-11-16</date>
<headline>XCode 2.2 (10.4 only).</headline>
<body>
<p>
The Fink team has had reports of some build problems with the XCode 2.2 compilers.  Until these are sorted out, we recommend that users hold off on upgrading XCode.
</p>
<p>
For those who have already installed XCode 2.2 and don't want to revert to 2.1, your participation in the effort to find packages that don't work and to fix them so that they do is welcomed!
</p>

</body>
</newsitem>
<newsitem>
<date>2005-06-09</date>
<headline>New Fink releases.</headline>
<body>
<p>
Three new Fink releases are 
<varlink url="download/index.php">available</varlink>
 today: version 0.8.0 (for 10.4),
version 0.7.2 (for 10.3), and version 0.6.4 (for 10.2).
All three releases include source files, binary packages, and a Fink
installer for new users.
</p>
<p>
The new release for 10.4 includes all currently-available "stable" packages
in source and binary form: there are 1565 of these, which constitutes more
than 80% of the 1909 packages available in the 10.3 release.  Work continues
by the fink developers on bringing more of the stable packages to Tiger.
</p>
<p>
The new release for 10.2 will be the last official release for that
version of Mac OS X.  Although no further updates (not even security
updates) will be provided by the Fink team, we anticipate that the
0.6.4 release will be usable for years to come.
</p>
<p>